{
  "$schema": "https://json-schema.org/draft/2020-12/schema",
  "title": "Simulatte plugin manifest",
  "type": "object",
  "required": [
    "schema",
    "id",
    "version",
    "sdkVersion",
    "entry",
    "resources",
    "permissions",
    "datasets",
    "provides",
    "consumes",
    "extensionPoints",
    "receiptSchemas",
    "configSchema",
    "defaultConfig"
  ],
  "additionalProperties": false,
  "properties": {
    "schema": {
      "enum": [
        "simulatte.pluginManifest.v1",
        "simulatte.pluginManifest.v2",
        "simulatte.pluginManifest.v3"
      ]
    },
    "id": {
      "type": "string",
      "pattern": "^[a-z0-9]+(?:-[a-z0-9]+)*$"
    },
    "version": {
      "type": "string",
      "pattern": "^[0-9]+\\.[0-9]+\\.[0-9]+$"
    },
    "sdkVersion": {
      "enum": [
        1,
        2
      ]
    },
    "entry": {
      "type": "object",
      "required": [
        "path",
        "integrity",
        "globalFactory"
      ],
      "additionalProperties": false,
      "properties": {
        "path": {
          "type": "string",
          "minLength": 1
        },
        "integrity": {
          "type": "string",
          "pattern": "^sha384-[a-f0-9]{96}$"
        },
        "globalFactory": {
          "type": "string",
          "minLength": 1
        }
      }
    },
    "resources": {
      "type": "array",
      "items": {
        "type": "object",
        "required": [
          "path",
          "integrity"
        ],
        "additionalProperties": false,
        "properties": {
          "path": {
            "type": "string",
            "minLength": 1
          },
          "integrity": {
            "type": "string",
            "pattern": "^sha384-[a-f0-9]{96}$"
          }
        }
      }
    },
    "permissions": {
      "type": "array",
      "uniqueItems": true,
      "items": {
        "enum": [
          "capabilities.invoke.v1",
          "clock.read.v1",
          "events.propose.v1",
          "language.parse.v1",
          "receipts.append.v1",
          "routing.contribute.v1",
          "simulation.run.v1",
          "state.reduce.v1",
          "ui.inspector.v1",
          "world.query.v1",
          "random.stream.v1",
          "simulation.schedule.v1",
          "compute.worker.v1",
          "environment.read.v1",
          "geography.project.v1",
          "ui.geospatial.v1",
          "tier.query.v1"
        ]
      }
    },
    "datasets": {
      "type": "array",
      "items": {
        "type": "object",
        "required": [
          "id",
          "required"
        ],
        "additionalProperties": false,
        "properties": {
          "id": {
            "type": "string",
            "minLength": 1
          },
          "required": {
            "type": "boolean"
          },
          "reference": {
            "type": "object",
            "required": [
              "id",
              "path",
              "sha256",
              "schemaId"
            ],
            "additionalProperties": false,
            "properties": {
              "id": {
                "type": "string",
                "minLength": 1
              },
              "path": {
                "type": "string",
                "minLength": 1
              },
              "sha256": {
                "type": "string",
                "pattern": "^[a-f0-9]{64}$"
              },
              "schemaId": {
                "type": "string",
                "minLength": 1
              }
            }
          }
        }
      }
    },
    "provides": {
      "type": "array",
      "uniqueItems": true,
      "items": {
        "type": "string",
        "minLength": 1
      }
    },
    "consumes": {
      "type": "array",
      "items": {
        "type": "object",
        "required": [
          "id",
          "required"
        ],
        "additionalProperties": false,
        "properties": {
          "id": {
            "type": "string",
            "minLength": 1
          },
          "required": {
            "type": "boolean"
          }
        }
      }
    },
    "extensionPoints": {
      "type": "array",
      "uniqueItems": true,
      "items": {
        "enum": [
          "request",
          "route",
          "event",
          "settlement",
          "ui",
          "presentation"
        ]
      }
    },
    "receiptSchemas": {
      "type": "array",
      "uniqueItems": true,
      "items": {
        "type": "string",
        "minLength": 1
      }
    },
    "configSchema": {
      "type": "string",
      "minLength": 1
    },
    "defaultConfig": {
      "type": "string",
      "minLength": 1
    },
    "governance": {
      "type": "object",
      "required": [
        "trustLevel",
        "executionIsolation",
        "publisher",
        "provenance",
        "signatureStatus",
        "marketplaceEligible",
        "status",
        "revocationId"
      ],
      "additionalProperties": false,
      "properties": {
        "trustLevel": { "const": "repository-bundled" },
        "executionIsolation": { "const": "same-realm-contract" },
        "publisher": { "const": "simulatte" },
        "provenance": { "const": "repository-source" },
        "signatureStatus": { "const": "not-applicable-repository-bundled" },
        "marketplaceEligible": { "const": false },
        "status": { "enum": ["active", "revoked"] },
        "revocationId": {
          "type": "string",
          "pattern": "^plugin:[a-z0-9]+(?:-[a-z0-9]+)*@[0-9]+\\.[0-9]+\\.[0-9]+$"
        }
      }
    }
  },
  "allOf": [
    {
      "if": {
        "properties": { "schema": { "const": "simulatte.pluginManifest.v3" } }
      },
      "then": { "required": ["governance"] },
      "else": { "not": { "required": ["governance"] } }
    },
    {
      "if": {
        "properties": {
          "sdkVersion": {
            "const": 1
          }
        }
      },
      "then": {
        "properties": {
          "permissions": {
            "items": {
              "enum": [
                "capabilities.invoke.v1",
                "clock.read.v1",
                "events.propose.v1",
                "language.parse.v1",
                "receipts.append.v1",
                "routing.contribute.v1",
                "simulation.run.v1",
                "state.reduce.v1",
                "ui.inspector.v1",
                "world.query.v1"
              ]
            }
          }
        }
      }
    }
  ]
}
