{
  "configSchema": "./config.schema.json",
  "consumes": [],
  "datasets": [
    {
      "id": "asteroid-decision-policies-v1",
      "reference": {
        "id": "asteroid-decision-policies-v1",
        "path": "../../../data/asteroid-defense/decision-policies-v1.json",
        "schemaId": "simulatte.asteroidDecisionPolicies.v1",
        "sha256": "c70695a9040fddd86bceb5e0a7cf99a1dd08b7384630b784632bcedf95fa25f9"
      },
      "required": true
    },
    {
      "id": "asteroid-execution-uncertainty-models-v1",
      "reference": {
        "id": "asteroid-execution-uncertainty-models-v1",
        "path": "../../../data/asteroid-defense/execution-uncertainty-models-v1.json",
        "schemaId": "simulatte.asteroidExecutionUncertainty.v1",
        "sha256": "e934589e9db72278fc8005ce51ef3aa874ebb495f6b2b908f735fdc3ca4a520a"
      },
      "required": true
    },
    {
      "id": "asteroid-force-models-v1",
      "reference": {
        "id": "asteroid-force-models-v1",
        "path": "../../../data/asteroid-defense/force-models-v1.json",
        "schemaId": "simulatte.asteroidForceModels.v1",
        "sha256": "9b593b32915282106a87b89019606d5b99f88639fe38c1be944991a21f866f81"
      },
      "required": true
    },
    {
      "id": "asteroid-historical-benchmark-cases-v1",
      "reference": {
        "id": "asteroid-historical-benchmark-cases-v1",
        "path": "../../../data/asteroid-defense/historical-benchmark-cases-v1.json",
        "schemaId": "simulatte.asteroidHistoricalBenchmarks.v1",
        "sha256": "f17fec3394a65279759481caad41c798fe7560b66e928a3932a0b938836d1b77"
      },
      "required": true
    },
    {
      "id": "asteroid-intervention-archetypes-v1",
      "reference": {
        "id": "asteroid-intervention-archetypes-v1",
        "path": "../../../data/asteroid-defense/intervention-archetypes-v1.json",
        "schemaId": "simulatte.asteroidInterventionArchetypes.v1",
        "sha256": "30b1c096c23044131654a494bb8f952a20b2dfac6d3ec3b1993d4fa9f77011c9"
      },
      "required": true
    },
    {
      "id": "asteroid-jpl-neo-context-v1",
      "reference": {
        "id": "asteroid-jpl-neo-context-v1",
        "path": "../../../data/asteroid-defense/jpl-neo-context-v1.json",
        "schemaId": "simulatte.asteroidJplNeoCatalog.v1",
        "sha256": "5b67d9b8164f18be7bf4e33bc156e85ff1b286e933fa66b8814295ea54d245ab"
      },
      "required": true
    },
    {
      "id": "asteroid-jpl-reference-snapshots-v1",
      "reference": {
        "id": "asteroid-jpl-reference-snapshots-v1",
        "path": "../../../data/asteroid-defense/jpl-reference-snapshots-v1.json",
        "schemaId": "simulatte.asteroidJplReferenceSnapshots.v1",
        "sha256": "ff444a7d58beb28d69c2b2c460530b76d13e24a7b4a719e43f7f177684891eda"
      },
      "required": true
    },
    {
      "id": "asteroid-model-governance-v1",
      "reference": {
        "id": "asteroid-model-governance-v1",
        "path": "../../../data/asteroid-defense/model-governance-v1.json",
        "schemaId": "simulatte.asteroidModelGovernance.v1",
        "sha256": "219fba4e06e82dec27f707fc5bd3446d0b73d34e833382eaefe26da25eb0435f"
      },
      "required": true
    },
    {
      "id": "asteroid-observer-stations-v1",
      "reference": {
        "id": "asteroid-observer-stations-v1",
        "path": "../../../data/asteroid-defense/observer-stations-v1.json",
        "schemaId": "simulatte.asteroidObserverStations.v1",
        "sha256": "bac48d258a2b10d9670722e830679fcf67a973ce03a9ed92a3a9f6fe2f73bba9"
      },
      "required": true
    },
    {
      "id": "asteroid-provenance-registry-v1",
      "reference": {
        "id": "asteroid-provenance-registry-v1",
        "path": "../../../data/asteroid-defense/provenance-registry-v1.json",
        "schemaId": "simulatte.asteroidProvenanceRegistry.v1",
        "sha256": "3a372ab52b769481065aba1930d84d21c29a854206a1981e41f1db66131d3b9b"
      },
      "required": true
    },
    {
      "id": "asteroid-synthetic-observation-campaigns-v1",
      "reference": {
        "id": "asteroid-synthetic-observation-campaigns-v1",
        "path": "../../../data/asteroid-defense/synthetic-observation-campaigns-v1.json",
        "schemaId": "simulatte.asteroidSyntheticCampaigns.v1",
        "sha256": "19a382e5a66ca5b53aee385ddeeaef9d120f8c2f51721b55ff68a528d4a59c2a"
      },
      "required": true
    }
  ],
  "defaultConfig": "./default-config.json",
  "entry": {
    "globalFactory": "SimulattePluginAsteroidDefense",
    "integrity": "sha384-03afac934acfd6823da2a4804f7a3cc4c53c4b4b329047ea5129161a9a6bfb2ed098893d3a29a3ff265089c3d7bd00d4",
    "path": "./index.js"
  },
  "extensionPoints": [
    "request",
    "event",
    "settlement",
    "ui",
    "presentation"
  ],
  "id": "asteroid-defense",
  "permissions": [
    "events.propose.v1",
    "receipts.append.v1",
    "state.reduce.v1",
    "ui.geospatial.v1",
    "ui.inspector.v1"
  ],
  "provides": [
    "simulation.asteroid-defense.v1",
    "propagation.n-body.v1"
  ],
  "receiptSchemas": [
    "simulatte.plugin.asteroidScenarioReceipt.v1",
    "simulatte.plugin.asteroidSettlementReceipt.v1",
    "simulatte.plugin.asteroidComparisonReceipt.v1",
    "simulatte.comparisonExecutionReceipt.v4"
  ],
  "resources": [
    {
      "integrity": "sha384-845ede68a5c33261dac4928f3b8ecdf23ee85c2ba282e5db91943430c1441797109664459f1fc5040be8a3d6639615a9",
      "path": "./config.schema.json"
    },
    {
      "integrity": "sha384-48368d1bff53f7b0c19058bbbb33193a9abbd2cbfe8effd5bbb907bd39044b5765ed113cd0136e060841a6a8d8ceec1b",
      "path": "./default-config.json"
    },
    {
      "integrity": "sha384-9a19ca8283fca07fada0c9e5058d4b5d94687021496b64444d503e6ae6789c263bc8733c3c806a1b372ab7782473a566",
      "path": "./asteroid-catalog.js"
    },
    {
      "integrity": "sha384-da32dd40499b3390341dca8b6737ce5e7d2aa07730faae8263e7a129ba414315ca9587887b40c22d5fba187befa642c1",
      "path": "./covariance-ensemble.js"
    },
    {
      "integrity": "sha384-3695e7c9bb72cc6b229181877a4d8ef4940f3c0421cee76329d688f67ef40c09d3b8ba0af46319e4d2b73c09e9097633",
      "path": "./encounter-model.js"
    },
    {
      "path": "./observation-program.js",
      "integrity": "sha384-c3f2fad0599002b6fe9e8604403c76913a82f6a6d41b8a7568151cfdc8f9cd0b9b4162c0d3766971ba3c36ff69fb4597"
    },
    {
      "integrity": "sha384-d0a92d3127c7e0afb3d1d32fbfa607ecff0c9a7abad27072d4def00af7f73edb51db057fde01ca3a5e3a0048d1d8b1ae",
      "path": "./orbit-determination.js"
    },
    {
      "integrity": "sha384-996aba52a3eca6b51dd06d525fbb51ac0e6f85fe18c5502c81b9530735be1f0d15f85884596820b56bd951482a73b256",
      "path": "./asteroid-model.js"
    },
    {
      "integrity": "sha384-d67cfc45f07713de03abfa912d195982f8e93090ebbb35e6cffb25dc73415b9786a8ca157bd1867baa6550c477959ae2",
      "path": "./v4-contribution.js"
    },
    {
      "integrity": "sha384-32258d9cb6d7c3dc62fd95b1053306a58eb1ffde3dbbe24e2638dcfaf6f6e2a9447ea528e3644601850a3eb1860b1a84",
      "path": "./comparison-driver.js"
    },
    {
      "integrity": "sha384-763e8cd27eec7afed84efc441cd1c192b4a49fc7b316387d085421e4800eb683e057dc5fa0b43a7138cdb3d4293639bc",
      "path": "./presentation.js"
    }
  ],
  "governance": {
    "trustLevel": "repository-bundled",
    "executionIsolation": "same-realm-contract",
    "publisher": "simulatte",
    "provenance": "repository-source",
    "signatureStatus": "not-applicable-repository-bundled",
    "marketplaceEligible": false,
    "status": "active",
    "revocationId": "plugin:asteroid-defense@2.0.0"
  },
  "schema": "simulatte.pluginManifest.v3",
  "sdkVersion": 2,
  "version": "2.0.0"
}
