{
  "configSchema": "./config.schema.json",
  "consumes": [],
  "datasets": [
    {
      "id": "nyc-crash-history-2025-07-to-2026-07-v1",
      "reference": {
        "id": "nyc-crash-history-2025-07-to-2026-07-v1",
        "path": "../../../data/simulatte/safety-history-index-v1.json",
        "schemaId": "simulatte.autonomySafetyHistoryIndex.v1",
        "sha256": "3b7aee9ec349c558f32778c3797f87a8c39d34dbb8f3d42cc1ed47079f5bc602"
      },
      "required": true
    }
  ],
  "defaultConfig": "./default-config.json",
  "entry": {
    "globalFactory": "SimulattePluginSafetyExplorer",
    "integrity": "sha384-bf7ca780d0c389bf003ef09b2e7f35a4939bb79dc99509e17d8679594835e7d8df8a89c8e850976037a3f94262a282a1",
    "path": "./index.js"
  },
  "extensionPoints": [
    "route",
    "ui",
    "presentation"
  ],
  "id": "safety-explorer",
  "permissions": [
    "events.propose.v1",
    "receipts.append.v1",
    "routing.contribute.v1",
    "state.reduce.v1",
    "ui.inspector.v1"
  ],
  "provides": [
    "routing.dimension.historical-observation.v1",
    "routing.dimension.historical-observation.v2",
    "field.mobility-risk.v1"
  ],
  "receiptSchemas": [
    "simulatte.plugin.safetyExplorerRouteAudit.v1"
  ],
  "resources": [
    {
      "integrity": "sha384-1c890e5a242e3d870a02a4cb027102d16a5f5d2e3df3650a6d0a439d8f307d1f09e62e218eafd6d33f4edb1011e65cf7",
      "path": "./config.schema.json"
    },
    {
      "integrity": "sha384-f4230093f9bc9b92e7145f1da988b87b8a20fd6247e0fe13a11c4b5293272447dbf485976e560f1bd285aa8e04e16c10",
      "path": "./default-config.json"
    }
  ],
  "schema": "simulatte.pluginManifest.v1",
  "sdkVersion": 1,
  "version": "1.0.0"
}
