{
  "configSchema": "./config.schema.json",
  "consumes": [],
  "datasets": [
    {
      "id": "nyc-real-estate-region-index-2026-v1",
      "reference": {
        "id": "nyc-real-estate-region-index-2026-v1",
        "path": "../../../data/nyc-real-estate/region-index-v1.json",
        "schemaId": "simulatte.nycRealEstateRegionIndex.v1",
        "sha256": "d17cafe51f239017dd168d02ce3c250d5ac19bcc6c0f49900b72a11cb4adae70"
      },
      "required": true
    },
    {
      "id": "nyc-real-estate-model-governance-v1",
      "reference": {
        "id": "nyc-real-estate-model-governance-v1",
        "path": "../../../data/nyc-real-estate/model-governance-v1.json",
        "schemaId": "simulatte.nycRealEstateModelGovernance.v1",
        "sha256": "4a6bc387b12322b14a58c3b9ec36ad70c81a7ff5ebd06ad4cb28ac134be3cf65"
      },
      "required": true
    },
    {
      "id": "nyc-real-estate-city-surface-2026-v1",
      "reference": {
        "id": "nyc-real-estate-city-surface-2026-v1",
        "path": "../../../data/nyc-real-estate/city-surface-v1.json",
        "schemaId": "simulatte.nycRealEstateCitySurface.v1",
        "sha256": "0f607a451a599783746cdf43063f215ce1eebd5f2df997c7aa3b00293b698c84"
      },
      "required": true
    }
  ],
  "defaultConfig": "./default-config.json",
  "entry": {
    "globalFactory": "SimulattePluginNycRealEstate",
    "integrity": "sha384-c78bb72d015da43692f7f2413a7445894608014cbdad867806cd666f7cf66b7bfb40cf32e5290e6a882492d919b7ce7b",
    "path": "./index.js"
  },
  "extensionPoints": [
    "request",
    "event",
    "settlement",
    "ui",
    "presentation"
  ],
  "id": "nyc-real-estate",
  "permissions": [
    "events.propose.v1",
    "receipts.append.v1",
    "state.reduce.v1",
    "ui.geospatial.v1",
    "ui.inspector.v1"
  ],
  "provides": [
    "simulation.nyc-development-atlas.v1"
  ],
  "receiptSchemas": [
    "simulatte.plugin.nycRealEstateScenarioReceipt.v1",
    "simulatte.plugin.nycRealEstateSettlementReceipt.v1",
    "simulatte.plugin.nycRealEstateComparisonReceipt.v1",
    "simulatte.comparisonExecutionReceipt.v4"
  ],
  "resources": [
    {
      "integrity": "sha384-b9036361563d071d6cd5ff9a1168be6fec4e707153676b0f955f0e998e2d84d940446cc0ac859c332a90b0e8b59e7954",
      "path": "./config.schema.json"
    },
    {
      "integrity": "sha384-f670c8093925d6a9a8892dfaebea373f065914591b9099c47eb6ac3e6165a7511fdbfa5bcd9f113499550f13506a108b",
      "path": "./default-config.json"
    },
    {
      "integrity": "sha384-76dd7fb6d0f3fc29b6ddc04f17b2e437287d2c96091c3c9e5fb947e4581bf401992c572ac43e29297ab5030c7f6c50e6",
      "path": "./v4-contribution.js"
    },
    {
      "integrity": "sha384-def8a1617b030407e51e0c247efc80a75e15e83163fc8cbbeefb591dac79df278df491d19580451596a23d936a212a45",
      "path": "./comparison-driver.js"
    },
    {
      "integrity": "sha384-1dc5bd375f55d47dfe5c0bf1e7647efa3a9c4225ff9a8ae62e05afdafa2690028d41af269e480f2c0c8e7504e495bf39",
      "path": "./forecast-statistics.js"
    },
    {
      "integrity": "sha384-e5fbe3c1aa3ecd44d92905bf104704a3e040f9b456e9dc3fdab40fc1b8ded513ef37be28930aba8b467283694b59986d",
      "path": "./sector-model.js"
    },
    {
      "integrity": "sha384-4938c4bf84b253da627db2a955930d9e9faedaf1d12414828f445d40da744105fa1ec9735aef43c7a5d8f2dc6fac312d",
      "path": "./forecast-model.js"
    },
    {
      "integrity": "sha384-6c2c7a0688d5a74190c6902587c928c1c3ac2243c509109b77b8fd3eb3289ee1a6eae27db844d1f39abcaeca3f8c530f",
      "path": "./price-surface.js"
    }
  ],
  "governance": {
    "trustLevel": "repository-bundled",
    "executionIsolation": "same-realm-contract",
    "publisher": "simulatte",
    "provenance": "repository-source",
    "signatureStatus": "not-applicable-repository-bundled",
    "marketplaceEligible": false,
    "status": "active",
    "revocationId": "plugin:nyc-real-estate@1.0.0"
  },
  "schema": "simulatte.pluginManifest.v3",
  "sdkVersion": 2,
  "version": "1.0.0"
}
