{
  "configSchema": "./config.schema.json",
  "consumes": [],
  "datasets": [
    {
      "id": "jpl.horizons.heliocentric-vectors.v1",
      "reference": {
        "id": "jpl.horizons.heliocentric-vectors.v1",
        "path": "../../../data/orbital-transfer-planner/jpl-horizons-heliocentric-vectors-v1.json",
        "schemaId": "simulatte.jplHorizonsHeliocentricVectors.v1",
        "sha256": "dae6f914e45a5692b127dc122d9861c6f76770316979fd4c822ba8c83ae25020"
      },
      "required": true
    },
    {
      "id": "solar.system.gm-constants-de440.v1",
      "reference": {
        "id": "solar.system.gm-constants-de440.v1",
        "path": "../../../data/orbital-transfer-planner/gm-constants-de440-v1.json",
        "schemaId": "simulatte.solarSystemGmConstants.v1",
        "sha256": "54e129096f6aa63fec28ddd0fbcd4e70f1ba54fddd8435f0f3faf7041197bbd0"
      },
      "required": true
    },
    {
      "id": "solar.radiation.snapshot.v1",
      "reference": {
        "id": "solar.radiation.snapshot.v1",
        "path": "../../../data/orbital-transfer-planner/solar-radiation-snapshot-v1.json",
        "schemaId": "simulatte.solarRadiationSnapshot.v1",
        "sha256": "7033f000b18639dff8a548fc2481a679cdfc9b4b763722c5e3b120c1ea2f759f"
      },
      "required": false
    },
    {
      "id": "orbital.depots.v1",
      "reference": {
        "id": "orbital.depots.v1",
        "path": "../../../data/orbital-transfer-planner/orbital-depots-v1.json",
        "schemaId": "simulatte.orbitalDepots.v1",
        "sha256": "a2720a78cef373a127473c8950ba804dba7449d3507e89dd0605e437a0c373de"
      },
      "required": false
    },
    {
      "id": "spacecraft.archetypes.v1",
      "reference": {
        "id": "spacecraft.archetypes.v1",
        "path": "../../../data/orbital-transfer-planner/spacecraft-archetypes-v1.json",
        "schemaId": "simulatte.spacecraftArchetypes.v1",
        "sha256": "b264a7006fcdda4597dd498f15ea8b3f650a9895241662747081da3fd423de7b"
      },
      "required": false
    }
  ],
  "defaultConfig": "./default-config.json",
  "entry": {
    "globalFactory": "SimulattePluginOrbitalTransferPlanner",
    "integrity": "sha384-16f81c631d1816ab306bfc8d76dfd7b6fa27652b44c56fc4198367f0476f1d193462a0081bbb7626fcdeede736172f2f",
    "path": "./index.js"
  },
  "extensionPoints": [
    "request",
    "event",
    "settlement",
    "ui",
    "presentation"
  ],
  "id": "orbital-transfer-planner",
  "permissions": [
    "capabilities.invoke.v1",
    "clock.read.v1",
    "events.propose.v1",
    "random.stream.v1",
    "receipts.append.v1",
    "simulation.schedule.v1",
    "state.reduce.v1",
    "tier.query.v1",
    "ui.geospatial.v1",
    "ui.inspector.v1"
  ],
  "provides": [
    "field.solar-radiation.v1",
    "simulation.orbital-transfer.v1",
    "simulation.orbital-kinetics.v1"
  ],
  "receiptSchemas": [
    "simulatte.plugin.ephemerisIdentityReceipt.v1",
    "simulatte.plugin.ephemerisIdentityReceipt.v2",
    "simulatte.plugin.orbitalTransferReceipt.v1",
    "simulatte.plugin.orbitalTransferReceipt.v2",
    "simulatte.plugin.orbitalCounterfactualReceipt.v1",
    "simulatte.plugin.orbitalCounterfactualReceipt.v2"
  ],
  "resources": [
    {
      "integrity": "sha384-68b70436372c0a3063bd05d45cc1a7f2eb301b2ff75af9ba3f3330a63185aad53f74c6fed4b699ec362be21a99b983de",
      "path": "./config.schema.json"
    },
    {
      "integrity": "sha384-f2420109b87c5de1c64e18ca2ffefefaa002c496eb2eb9d96f418bdfcf7081b6dc41e297f311bba777a14eb9825c121f",
      "path": "./default-config.json"
    },
    {
      "integrity": "sha384-7ff783348859b671702aa8c12c08ea742d33a5bb1125e033f3faadd43d905e967130a9f7ea3ebdbfde55c842731d209b",
      "path": "./depot-ledger.js"
    },
    {
      "integrity": "sha384-0570ea3d88510e4fdb7c0e36750d818f1c957e36fd130f553a678ae71ad11badb77169d179e75caac36411452201682e",
      "path": "./ephemeris.js"
    },
    {
      "integrity": "sha384-95c580c099b72f9e857460ef0b282f2957a7c1272ead287b06497557e6ef8781173c182e4fae914815c77309988992c6",
      "path": "./hohmann.js"
    },
    {
      "integrity": "sha384-67e3f1b6af70b157523688b6e7b72b0dde57d66287c6b9d1a0e8617202328de80af9ea4cd8227629e7d76c8f225fcc11",
      "path": "./lambert.js"
    },
    {
      "integrity": "sha384-5affb8b76b2310416f6c7ff2b3e2746b1ed2925b8f4d75b0d6862dc172cb4cf2089b5400be6cf8a41b145ce00d5f5561",
      "path": "./patched-conic.js"
    },
    {
      "integrity": "sha384-9564dc541ebc0f978b6667d5fa23de01bafeed5c6df7151473e0261aaf9c7c6f8fe2e8cf74cefbafcba76ddd5791b93f",
      "path": "./launch-window.js"
    },
    {
      "integrity": "sha384-0e6bfe2f477c6da97fc716f6b8cab34be2abd2266e87ad16497c2451c26031a31475151d82edba7939d7cd793d13708c",
      "path": "./metrics.js"
    },
    {
      "integrity": "sha384-43548d7097c245f29b98d24c7b4b8bfb8633d31187d8f1a54f60a975ec6527f5d4140521439f8adfe783f7edb93b0c4e",
      "path": "./n-body-verifier.js"
    },
    {
      "integrity": "sha384-2aca43f268ee036677c2e7d19ea666805cf312e5c2ffa273e94aa46c64e52fd12d55edf1580307049fb19fafb8932407",
      "path": "./presentation.js"
    },
    {
      "integrity": "sha384-cdc5fa8f4b4dab7900f527ca441141afa3f259f322e241111887d3969025e4991f4a28435fd19cebfdab619a0ee84aa6",
      "path": "./radiation.js"
    },
    {
      "integrity": "sha384-79994192567dd99a8438c02be764d4c1934bab4439e4ec3f90f6b58db624800e4c094faaf9b7339e70d523e295871797",
      "path": "./v4-contribution.js"
    }
  ],
  "governance": {
    "trustLevel": "repository-bundled",
    "executionIsolation": "same-realm-contract",
    "publisher": "simulatte",
    "provenance": "repository-source",
    "signatureStatus": "not-applicable-repository-bundled",
    "marketplaceEligible": false,
    "status": "active",
    "revocationId": "plugin:orbital-transfer-planner@2.0.0"
  },
  "schema": "simulatte.pluginManifest.v3",
  "sdkVersion": 2,
  "version": "2.0.0"
}
